{
  "boundaries": [
    "Only canonical clear port-54992 game lanes are admitted; retransmitted bytes are reconstructed once.",
    "Capture deltas use the earliest packet that completes every byte of the reconstructed outer frame.",
    "The packet-header clock is the u32 at game-message header +0x08; the following reserved u32 must be zero.",
    "No target event occurs in login.pcapng, and no public artifact joins another capture to its lobby connection or SERVER_UTC session.",
    "Neighbor rows contain only same-lane wrapped-event order and bounded numeric deltas; they do not establish a state transition or cause.",
    "No raw payload, endpoint address, actor identifier, name, token, session identifier, or capture timestamp field is published; the required header clock and exact delta permit capture-time reconstruction.",
    "Application values and derived sums establish client arithmetic; subopcode nouns, UI divisions, and server policy require their own evidence tiers."
  ],
  "chronology": {
    "compound_target_frames": 1,
    "neighborhood_radius": 3,
    "neighborhood_rows": 54,
    "repeated_same_pair_events": 0
  },
  "clock_correlations": {
    "capture_completion_pairs": 9,
    "derived_sum_delta_us_max": 900013696,
    "derived_sum_delta_us_min": 1373132,
    "header_clock_delta_us_max": 192541,
    "header_clock_delta_us_max_abs": 626868,
    "header_clock_delta_us_min": -626868,
    "header_clock_equals_outer_floor_pairs": 9,
    "outer_value_scaled_delta_us_max": 219541,
    "outer_value_scaled_delta_us_min": -31882,
    "same_capture_lobby_clock_pairs": 0,
    "same_session_server_utc_pairs": 0,
    "target_events_in_login_capture": 0
  },
  "corpus": {
    "admitted_chat_lanes": 30,
    "admitted_lanes": 84,
    "admitted_main_lanes": 54,
    "admitted_unparsed_frame_body_bytes": 0,
    "all_connection_retransmitted_overlap_bytes": 33424,
    "c2s_frames": 8970,
    "c2s_subevents": 21201,
    "c2s_wrapped_subevents": 21109,
    "captures": 54,
    "compressed_frame_inflate_failures": 0,
    "corpus_sha256": "1293490808399dd5e1015d921a388f0fe4931dfa3ef678f30d790f5296025e6a",
    "decoded_target_events": 9,
    "discarded_c2s_trailing_stream_bytes": 0,
    "discarded_s2c_trailing_stream_bytes": 228,
    "discarded_trailing_stream_bytes": 228,
    "excluded_connection_retransmitted_overlap_bytes": 102,
    "frame_shaped_connections": 88,
    "retransmitted_c2s_overlap_bytes": 288,
    "retransmitted_overlap_bytes": 33322,
    "retransmitted_s2c_overlap_bytes": 33034,
    "s2c_frames": 10790,
    "s2c_subevents": 44663,
    "s2c_wrapped_subevents": 44556,
    "subevent_truncations": 0,
    "target_c2s_events": 0,
    "target_s2c_events": 9,
    "wrapped_short_inner_headers": 0
  },
  "distributions": {
    "application_values": {
      "15": 2,
      "2": 6,
      "900": 1
    },
    "compound_target_frames": 1,
    "events_by_capture": {
      "gridania_to_coerthas.pcapng": 1,
      "move_out_of_room.pcapng": 1,
      "party_battle_leve.pcapng": 1,
      "return_to_inn.pcapng": 2,
      "teleport_to_camp_nine_ivies.pcapng": 1,
      "teleport_to_camp_tranquil.pcapng": 1,
      "teleport_to_gridania.pcapng": 1,
      "war_quest_update2.pcapng": 1
    },
    "events_by_direction": {
      "s2c": 9
    },
    "events_by_lane": {
      "main": 9
    },
    "repeated_same_pair_events": 0,
    "special_sentinel": {
      "no": 9
    },
    "subopcode_value_pairs": {
      "0x12/900": 1,
      "0x14/15": 2,
      "0x14/2": 6
    },
    "subopcodes": {
      "0x12": 1,
      "0x14": 8
    }
  },
  "exclusions": {
    "lobby_54994_connections": 2,
    "nonzero_packet_header_reserved": 0,
    "other_non_game_connections": 0,
    "tls_signature_connections": 2,
    "unexpected_application_shape": 0,
    "unexpected_subevent_size": 0
  },
  "per_capture": {
    "accept_leve.pcapng": {
      "admitted_chat_lanes": 1,
      "admitted_lanes": 2,
      "admitted_main_lanes": 1,
      "decoded_events": 0,
      "discarded_trailing_stream_bytes": 6,
      "exclusions": {},
      "frame_shaped_connections": 2,
      "retransmitted_overlap_bytes": 396,
      "target_c2s_events": 0,
      "target_s2c_events": 0
    },
    "accept_local_leve.pcapng": {
      "admitted_chat_lanes": 0,
      "admitted_lanes": 1,
      "admitted_main_lanes": 1,
      "decoded_events": 0,
      "discarded_trailing_stream_bytes": 6,
      "exclusions": {},
      "frame_shaped_connections": 1,
      "retransmitted_overlap_bytes": 336,
      "target_c2s_events": 0,
      "target_s2c_events": 0
    },
    "accept_quest.pcapng": {
      "admitted_chat_lanes": 1,
      "admitted_lanes": 2,
      "admitted_main_lanes": 1,
      "decoded_events": 0,
      "discarded_trailing_stream_bytes": 6,
      "exclusions": {},
      "frame_shaped_connections": 2,
      "retransmitted_overlap_bytes": 204,
      "target_c2s_events": 0,
      "target_s2c_events": 0
    },
    "action_and_traits.pcapng": {
      "admitted_chat_lanes": 0,
      "admitted_lanes": 1,
      "admitted_main_lanes": 1,
      "decoded_events": 0,
      "discarded_trailing_stream_bytes": 6,
      "exclusions": {},
      "frame_shaped_connections": 1,
      "retransmitted_overlap_bytes": 330,
      "target_c2s_events": 0,
      "target_s2c_events": 0
    },
    "add_str.pcapng": {
      "admitted_chat_lanes": 0,
      "admitted_lanes": 1,
      "admitted_main_lanes": 1,
      "decoded_events": 0,
      "discarded_trailing_stream_bytes": 6,
      "exclusions": {},
      "frame_shaped_connections": 1,
      "retransmitted_overlap_bytes": 180,
      "target_c2s_events": 0,
      "target_s2c_events": 0
    },
    "attributes.pcapng": {
      "admitted_chat_lanes": 0,
      "admitted_lanes": 1,
      "admitted_main_lanes": 1,
      "decoded_events": 0,
      "discarded_trailing_stream_bytes": 0,
      "exclusions": {},
      "frame_shaped_connections": 1,
      "retransmitted_overlap_bytes": 216,
      "target_c2s_events": 0,
      "target_s2c_events": 0
    },
    "battle_mode_passive_mode.pcapng": {
      "admitted_chat_lanes": 1,
      "admitted_lanes": 2,
      "admitted_main_lanes": 1,
      "decoded_events": 0,
      "discarded_trailing_stream_bytes": 0,
      "exclusions": {},
      "frame_shaped_connections": 2,
      "retransmitted_overlap_bytes": 84,
      "target_c2s_events": 0,
      "target_s2c_events": 0
    },
    "buy_square_maple_shield.pcapng": {
      "admitted_chat_lanes": 1,
      "admitted_lanes": 2,
      "admitted_main_lanes": 1,
      "decoded_events": 0,
      "discarded_trailing_stream_bytes": 6,
      "exclusions": {},
      "frame_shaped_connections": 2,
      "retransmitted_overlap_bytes": 378,
      "target_c2s_events": 0,
      "target_s2c_events": 0
    },
    "change_bodyarmor.pcapng": {
      "admitted_chat_lanes": 0,
      "admitted_lanes": 1,
      "admitted_main_lanes": 1,
      "decoded_events": 0,
      "discarded_trailing_stream_bytes": 6,
      "exclusions": {},
      "frame_shaped_connections": 1,
      "retransmitted_overlap_bytes": 288,
      "target_c2s_events": 0,
      "target_s2c_events": 0
    },
    "change_helm.pcapng": {
      "admitted_chat_lanes": 0,
      "admitted_lanes": 1,
      "admitted_main_lanes": 1,
      "decoded_events": 0,
      "discarded_trailing_stream_bytes": 0,
      "exclusions": {},
      "frame_shaped_connections": 1,
      "retransmitted_overlap_bytes": 342,
      "target_c2s_events": 0,
      "target_s2c_events": 0
    },
    "change_to_botanist.pcapng": {
      "admitted_chat_lanes": 1,
      "admitted_lanes": 2,
      "admitted_main_lanes": 1,
      "decoded_events": 0,
      "discarded_trailing_stream_bytes": 6,
      "exclusions": {},
      "frame_shaped_connections": 2,
      "retransmitted_overlap_bytes": 312,
      "target_c2s_events": 0,
      "target_s2c_events": 0
    },
    "chat_say.pcapng": {
      "admitted_chat_lanes": 0,
      "admitted_lanes": 1,
      "admitted_main_lanes": 1,
      "decoded_events": 0,
      "discarded_trailing_stream_bytes": 0,
      "exclusions": {},
      "frame_shaped_connections": 1,
      "retransmitted_overlap_bytes": 90,
      "target_c2s_events": 0,
      "target_s2c_events": 0
    },
    "chat_shout.pcapng": {
      "admitted_chat_lanes": 0,
      "admitted_lanes": 1,
      "admitted_main_lanes": 1,
      "decoded_events": 0,
      "discarded_trailing_stream_bytes": 0,
      "exclusions": {},
      "frame_shaped_connections": 1,
      "retransmitted_overlap_bytes": 72,
      "target_c2s_events": 0,
      "target_s2c_events": 0
    },
    "check_room_map.pcapng": {
      "admitted_chat_lanes": 0,
      "admitted_lanes": 1,
      "admitted_main_lanes": 1,
      "decoded_events": 0,
      "discarded_trailing_stream_bytes": 6,
      "exclusions": {},
      "frame_shaped_connections": 1,
      "retransmitted_overlap_bytes": 246,
      "target_c2s_events": 0,
      "target_s2c_events": 0
    },
    "checkbed.pcapng": {
      "admitted_chat_lanes": 0,
      "admitted_lanes": 1,
      "admitted_main_lanes": 1,
      "decoded_events": 0,
      "discarded_trailing_stream_bytes": 6,
      "exclusions": {},
      "frame_shaped_connections": 1,
      "retransmitted_overlap_bytes": 102,
      "target_c2s_events": 0,
      "target_s2c_events": 0
    },
    "coerthas_map.pcapng": {
      "admitted_chat_lanes": 1,
      "admitted_lanes": 2,
      "admitted_main_lanes": 1,
      "decoded_events": 0,
      "discarded_trailing_stream_bytes": 6,
      "exclusions": {},
      "frame_shaped_connections": 2,
      "retransmitted_overlap_bytes": 156,
      "target_c2s_events": 0,
      "target_s2c_events": 0
    },
    "combat_autoattack.pcapng": {
      "admitted_chat_lanes": 1,
      "admitted_lanes": 2,
      "admitted_main_lanes": 1,
      "decoded_events": 0,
      "discarded_trailing_stream_bytes": 0,
      "exclusions": {},
      "frame_shaped_connections": 2,
      "retransmitted_overlap_bytes": 312,
      "target_c2s_events": 0,
      "target_s2c_events": 0
    },